{
  "$schema": "../schema.json",
  "lectures": [
    {
      "id": 1,
      "type": "Aud",
      "duration": 2,
      "professors": [
        1
      ],
      "groups": [
        1
      ]
    }
  ],
  "professors": [
    {
      "id": 1,
      "availability": [
        1,
        2,
        3,
        4,
        5,
        6,
        7
      ]
    }
  ],
  "groups": [
    {
      "id": 1,
      "size": 100,
      "overlapping": []
    }
  ],
  "rooms": [
    {
      "id": 1,
      "capacity": 99,
      "type": "Aud",
      "availability": [
        1,
        2,
        3,
        4,
        5,
        6,
        7
      ]
    }
  ]
}