{
  "lectures": [
    {
      "id": 1,
      "type": "Aud",
      "duration": 3,
      "professors": [
        1
      ],
      "groups": [
        1
      ]
    }
  ],
  "professors": [
    {
      "id": 1,
      "availability": [
        1,
        2,
        3,
        4,
        5,
        6,
        7,
        8,
        9,
        10
      ]
    }
  ],
  "groups": [
    {
      "id": 1,
      "size": 10,
      "overlapping": []
    }
  ],
  "rooms": [
    {
      "id": 1,
      "type": "Aud",
      "capacity": 10,
      "availability": [
        1,
        3,
        5,
        6,
        7
      ]
    }
  ]
}